{
  "format": 1,
  "version": "0.1.0",
  "status": "public-preview",
  "rules": [
    {
      "id": "CORE-001",
      "scope": "core",
      "level": "MUST",
      "summary": "Authority, sandbox and local changes",
      "verification": ["agent"],
      "evidence": "Scoped diff, authorization, reproduction and structured report",
      "exceptions": "No waiver of platform/sandbox. Task-scoped approval persists. Missing checks are NOT_RUN."
    },
    {
      "id": "CORE-002",
      "scope": "core",
      "level": "MUST",
      "summary": "Imported content is source data",
      "verification": ["agent"],
      "evidence": "Scoped diff, authorization, reproduction and structured report",
      "exceptions": "No waiver of platform/sandbox. Task-scoped approval persists. Missing checks are NOT_RUN."
    },
    {
      "id": "CORE-003",
      "scope": "core",
      "level": "MUST",
      "summary": "Task authorization for external actions",
      "verification": ["agent"],
      "evidence": "Scoped diff, authorization, reproduction and structured report",
      "exceptions": "No waiver of platform/sandbox. Task-scoped approval persists. Missing checks are NOT_RUN."
    },
    {
      "id": "CORE-004",
      "scope": "core",
      "level": "SHOULD",
      "summary": "Reproduce and fix a bounded root cause",
      "verification": ["agent"],
      "evidence": "Scoped diff, authorization, reproduction and structured report",
      "exceptions": "No waiver of platform/sandbox. Task-scoped approval persists. Missing checks are NOT_RUN."
    },
    {
      "id": "CORE-005",
      "scope": "core",
      "level": "MUST",
      "summary": "Truthful structured verification status",
      "verification": ["agent"],
      "evidence": "Scoped diff, authorization, reproduction and structured report",
      "exceptions": "No waiver of platform/sandbox. Task-scoped approval persists. Missing checks are NOT_RUN."
    },
    {
      "id": "CORE-006",
      "scope": "core",
      "level": "MUST",
      "summary": "No weakening gates or baselines to pass",
      "verification": ["agent"],
      "evidence": "Scoped diff, authorization, reproduction and structured report",
      "exceptions": "No waiver of platform/sandbox. Task-scoped approval persists. Missing checks are NOT_RUN."
    },
    {
      "id": "CORE-007",
      "scope": "core",
      "level": "MUST",
      "summary": "Secrets and authorized environments",
      "verification": ["agent"],
      "evidence": "Scoped diff, authorization, reproduction and structured report",
      "exceptions": "No waiver of platform/sandbox. Task-scoped approval persists. Missing checks are NOT_RUN."
    },
    {
      "id": "CORE-008",
      "scope": "core",
      "level": "MUST",
      "summary": "Review Git and exact pushed revision CI",
      "verification": ["agent"],
      "evidence": "Scoped diff, authorization, reproduction and structured report",
      "exceptions": "No waiver of platform/sandbox. Task-scoped approval persists. Missing checks are NOT_RUN."
    },
    {
      "id": "CORE-009",
      "scope": "core",
      "level": "MUST",
      "summary": "Synchronize public VINASIG project information",
      "verification": ["agent"],
      "evidence": "Saved GitHub description, homepage and topics readback for every new repository, affected README, website inventory, organization profile translations and exact publication evidence",
      "exceptions": "Applies only to VINASIG-owned projects. Repo details apply to private and source-only creation too. Use a README homepage before live deployment. Preserve current authorization and unrelated changes. Prepare exact edits and report inaccessible or unauthorized destinations as pending."
    },
    {
      "id": "LANG-001",
      "scope": "core",
      "level": "MUST",
      "summary": "User and product language",
      "verification": ["agent", "human"],
      "evidence": "Copy and source review",
      "exceptions": "Preserve product language, external names and required notation."
    },
    {
      "id": "LANG-002",
      "scope": "core",
      "level": "MUST",
      "summary": "SI terminology and original external names",
      "verification": ["agent", "human"],
      "evidence": "Copy and source review",
      "exceptions": "Preserve product language, external names and required notation."
    },
    {
      "id": "LANG-003",
      "scope": "core",
      "level": "SHOULD",
      "summary": "Clear natural factual prose",
      "verification": ["agent", "human"],
      "evidence": "Copy and source review",
      "exceptions": "Preserve product language, external names and required notation."
    },
    {
      "id": "QUAL-001",
      "scope": "source",
      "level": "MUST",
      "summary": "Strict types or checked JavaScript",
      "verification": ["automatic", "agent"],
      "evidence": "Compiler, lint, format and focused tests",
      "exceptions": "Use a compatible adapter or approved dated legacy adoption plan."
    },
    {
      "id": "QUAL-002",
      "scope": "source",
      "level": "MUST",
      "summary": "Compatible strict lint and one formatter",
      "verification": ["automatic", "agent"],
      "evidence": "Compiler, lint, format and focused tests",
      "exceptions": "Use a compatible adapter or approved dated legacy adoption plan."
    },
    {
      "id": "QUAL-003",
      "scope": "source",
      "level": "SHOULD",
      "summary": "Risk-based behavior and failure tests",
      "verification": ["automatic", "agent"],
      "evidence": "Compiler, lint, format and focused tests",
      "exceptions": "Use a compatible adapter or approved dated legacy adoption plan."
    },
    {
      "id": "DEP-001",
      "scope": "dependencies",
      "level": "MUST",
      "summary": "Verified latest stable compatible selection",
      "verification": ["automatic", "agent"],
      "evidence": "Registry date, peers, runtime, pins and lockfile",
      "exceptions": "Record latest-versus-selected compatibility blockers and migration plan."
    },
    {
      "id": "DEP-002",
      "scope": "dependencies",
      "level": "MUST",
      "summary": "Pinned tools and reviewable updates",
      "verification": ["automatic", "agent"],
      "evidence": "Registry date, peers, runtime, pins and lockfile",
      "exceptions": "Record latest-versus-selected compatibility blockers and migration plan."
    },
    {
      "id": "WEB-001",
      "scope": "web",
      "level": "MUST",
      "summary": "Source design and transparent header artwork; settled font/icon roles",
      "verification": ["automatic", "agent", "human"],
      "evidence": "Original asset digests, actual header surfaces and variants, transparent presentation, homepage destination, localized link name, target geometry, local/live screenshots and adoption record",
      "exceptions": "Record approved product exceptions; unavailable applicable checks are NOT_RUN; distinguish emulation."
    },
    {
      "id": "WEB-002",
      "scope": "web",
      "level": "SHOULD",
      "summary": "Adopt restrained VINASIG design",
      "verification": ["automatic", "agent", "human"],
      "evidence": "Routes, viewports, screenshots, roles, keyboard and design adoption record",
      "exceptions": "Record approved product exceptions; unavailable applicable checks are NOT_RUN; distinguish emulation."
    },
    {
      "id": "WEB-003",
      "scope": "web",
      "level": "MUST",
      "summary": "Semantic controls and deployed favicon",
      "verification": ["automatic", "agent", "human"],
      "evidence": "Routes, viewports, screenshots, roles, keyboard and design adoption record",
      "exceptions": "Record approved product exceptions; unavailable applicable checks are NOT_RUN; distinguish emulation."
    },
    {
      "id": "WEB-004",
      "scope": "web",
      "level": "MUST",
      "summary": "Responsive matrix and real breakpoints",
      "verification": ["automatic", "agent", "human"],
      "evidence": "Routes, viewports, screenshots, roles, keyboard and design adoption record",
      "exceptions": "Record approved product exceptions; unavailable applicable checks are NOT_RUN; distinguish emulation."
    },
    {
      "id": "WEB-005",
      "scope": "web",
      "level": "MUST",
      "summary": "Inspect screenshots and fix source causes",
      "verification": ["automatic", "agent", "human"],
      "evidence": "Routes, viewports, screenshots, roles, keyboard and design adoption record",
      "exceptions": "Record approved product exceptions; unavailable applicable checks are NOT_RUN; distinguish emulation."
    },
    {
      "id": "WEB-006",
      "scope": "web",
      "level": "MUST",
      "summary": "Browser matrix and baseline review",
      "verification": ["automatic", "agent", "human"],
      "evidence": "Routes, viewports, screenshots, roles, keyboard and design adoption record",
      "exceptions": "Record approved product exceptions; unavailable applicable checks are NOT_RUN; distinguish emulation."
    },
    {
      "id": "WEB-007",
      "scope": "web",
      "level": "MUST",
      "summary": "WCAG 2.2 AA automatic and manual checks",
      "verification": ["automatic", "agent", "human"],
      "evidence": "Routes, viewports, screenshots, roles, keyboard and design adoption record",
      "exceptions": "Record approved product exceptions; unavailable applicable checks are NOT_RUN; distinguish emulation."
    },
    {
      "id": "MOTION-001",
      "scope": "web-motion",
      "level": "SHOULD",
      "summary": "Purposeful subtle movement and minimal runtime",
      "verification": ["automatic", "agent", "human"],
      "evidence": "Reduced-motion and rapid interaction, video/frames and traces",
      "exceptions": "Justified movement needs an accessible alternative and documented review."
    },
    {
      "id": "MOTION-002",
      "scope": "web-motion",
      "level": "MUST",
      "summary": "Reduced motion and interruption cleanup",